published,title,summary,link
"Sat, 04 Jan 2025 11:00:21 +0000",Investors Will Want Tesla's (NASDAQ:TSLA) Growth In ROCE To Persist,"If you're not sure where to start when looking for the next multi-bagger, there are a few key trends you should keep an...",https://finance.yahoo.com/news/investors-want-teslas-nasdaq-tsla-110021285.html?.tsrc=rss
"Sat, 04 Jan 2025 09:06:00 +0000",Tesla Has a Problem That Trump Can't Fix. Is It a Red Flag for Investors?,"In fact, he could make it worse.",https://www.fool.com/investing/2025/01/04/tesla-has-a-problem-that-trump-cant-fix-is-it-a-re/?source=eptyholnk0000202&utm_source=yahoo-host-full&utm_medium=feed&utm_campaign=article&referring_guid=90ed700c-47a2-4771-b36f-cba44649775b&.tsrc=rss
"Sat, 04 Jan 2025 06:49:24 +0000",Tesla Stock Jumps 8% as Free Supercharging for Life Makes a Comeback,Tesla Revives Free Supercharging to Boost Slumping Model S Sales,https://finance.yahoo.com/news/tesla-stock-jumps-8-free-064924723.html?.tsrc=rss
"Sat, 04 Jan 2025 02:00:00 +0000","In Two Attacks, a Pair of Unraveling Lives and Remaining Mysteries",New Orleans and Las Vegas grapple with the aftermath of deadly incidents; suicide note is recovered from exploded Tesla.,https://finance.yahoo.com/m/b6d093dd-cc5b-3524-92d4-161f517a5fd5/in-two-attacks%2C-a-pair-of.html?.tsrc=rss
"Sat, 04 Jan 2025 00:05:12 +0000",Why Dogecoin Is Soaring Today,"Dogecoin (CRYPTO: DOGE) has posted big gains over the last day of trading.  The crypto market has seen bullish momentum over the last day of trading, but there's also a major coin-specific catalyst for Dogecoin's gains.  Investors are betting that X's new payments system will be launching soon and that Dogecoin could be incorporated into the platform.",https://www.fool.com/investing/2025/01/03/why-dogecoin-is-soaring-today/?source=eptyholnk0000202&utm_source=yahoo-host-full&utm_medium=feed&utm_campaign=article&referring_guid=3be357ea-92f3-42bb-a01d-91d4b95e2aec&.tsrc=rss
"Sat, 04 Jan 2025 00:00:00 +0000","Green Beret in Tesla Explosion Suffered From PTSD, Authorities Say",Investigators recovered writings on Matthew Alan Livelsberger’s phone that aired concerns about the direction of the U.S.,https://finance.yahoo.com/m/87dcf1a9-32ee-3afb-8057-af574675e61c/green-beret-in-tesla.html?.tsrc=rss
"Fri, 03 Jan 2025 23:57:00 +0000",Musk’s Mystery Gift: $112 Million in Tesla Stock to Unnamed Charities,"The transaction was part of Musk’s year-end tax planning. The recipients “have no current intention to sell” the shares, the Securities and Exchange Commission filing said.",https://finance.yahoo.com/m/57f7e124-a8d3-3557-89e8-db5508efc60b/musk%E2%80%99s-mystery-gift%3A-%24112.html?.tsrc=rss
"Fri, 03 Jan 2025 23:57:00 +0000",Cybertruck Explosion: Green Beret Called Blast a ‘Wake Up Call’,"Las Vegas police used DNA to confirm that the body found in the Tesla Cybertruck after its explosion was Matthew Livelsberger, an active U.S. servicemember.",https://finance.yahoo.com/video/cybertruck-explosion-green-beret-called-235700664.html?.tsrc=rss
"Fri, 03 Jan 2025 23:23:00 +0000",What Car Sales Can Tell Us About the U.S. Auto Market Right Now,"Demand for pickup trucks and hybrid vehicles helped automakers increase deliveries, but challenges loom for 2025.",https://finance.yahoo.com/m/646b07e0-5e7a-374a-81e0-eec0a7e483ae/what-car-sales-can-tell-us.html?.tsrc=rss
"Fri, 03 Jan 2025 21:53:05 +0000",S&P 500 Gains and Losses Today: Index Jumps as Supermicro and Tesla Bounce Back,"The S&amp;P 500 added 1.3% on Friday, Jan. 3, ending a streak of five straight down days as stocks looked to regain their momentum to start the new trading year.",https://www.investopedia.com/s-and-p-500-gains-and-losses-today-index-jumps-as-supermicro-and-tesla-bounce-back-8768721?.tsrc=rss
"Fri, 03 Jan 2025 21:29:07 +0000","Canaccord boosts Tesla price target, calls 2025 'year of the robot'","Canaccord Genuity raised its price target on Tesla (TSLA) to $404 per share from $298, citing optimism over the company’s growth, including in its energy business and possible robotics venture. Market Domination hosts Josh Lipton and Josh Schafer note the firm remains bullish despite facing challenges and risks, such as potential EV tax credit reductions in the US and sluggish Full Self-Driving take rates. To watch more expert insights and analysis on the latest market action, check out more Market Domination here. This post was written by Josh Lynch",https://finance.yahoo.com/video/canaccord-boosts-tesla-price-target-212907657.html?.tsrc=rss
"Fri, 03 Jan 2025 21:22:00 +0000","Ford, GM Grew EV Sales Faster Than Tesla. What It Means for the Stocks.","Tesla  fourth-quarter sales didn’t live up to lofty expectations.  Ford Motor and General Motors on Friday reported their year-end U.S. delivery figures.  Ford stock added 2.3% on Friday, closing at $9.88 a share, while the  and  added about 1.3% and 0.8%, respectively.",https://finance.yahoo.com/m/98a0c18a-550d-3024-8cae-beab5155718d/ford%2C-gm-grew-ev-sales-faster.html?.tsrc=rss
"Fri, 03 Jan 2025 21:19:00 +0000","These Stocks Moved the Most Today: Tesla, U.S. Steel, Rivian, Nvidia, Carvana, Vistra, BUD, and More","Tesla stock rises after shares of the electric-vehicle maker tumbled following weaker-than-expected deliveries, Rivian surges as deliveries top estimates, and U.S. Steel declines as President Biden blocks the sale of the company to Japan’s Nippon Steel.",https://finance.yahoo.com/m/4ba2f792-626e-3f7f-8f9e-4c7ee5530245/these-stocks-moved-the-most.html?.tsrc=rss
"Fri, 03 Jan 2025 21:16:00 +0000","The Score: Boeing, Tesla, U.S. Steel and More Stocks That Defined the Week","A passenger plane in South Korea crashed on Dec. 29, killing nearly all of the 181 people on board, in one of the deadliest aviation disasters in recent years.  The U.S. National Transportation Safety Board said it was leading a team of American investigators—including representatives from the U.S. Federal Aviation Administration and  Boeing  —to assist South Korea’s officials in their probe.  The Boeing 737-800 suffered an apparent bird strike as it approached Muan International Airport, attempted to land at a high rate of speed without its landing gear down, slid off the runway and slammed into a concrete barrier.",https://finance.yahoo.com/m/6a74c947-2864-3aab-8ed2-6cf41b70b642/the-score%3A-boeing%2C-tesla%2C.html?.tsrc=rss
"Fri, 03 Jan 2025 21:15:00 +0000",Tesla Stock Jumped After Analyst Price Target Increase. So Much for the Bear Market.,The shares dropped more than 6% to start a new year of trading after the company reported weaker-than-expected fourth-quarter deliveries.,https://finance.yahoo.com/m/f7b662c8-965c-3de7-968f-e2d3c2145e9e/tesla-stock-jumped-after.html?.tsrc=rss
"Fri, 03 Jan 2025 20:29:13 +0000",Why Tesla Stock Is Surging Today,"Tesla (NASDAQ: TSLA) stock is seeing strong bullish momentum in Friday's trading.  The electric vehicle (EV) company's share price was up 6.9% as of 3:15 p.m. ET amid the backdrop of a 1.2% gain for the S&amp;P 500 index and a 1.7% gain for the Nasdaq Composite index.  In addition to bullish momentum for the broader market today, Tesla is gaining ground thanks to positive industry reports and analyst coverage.",https://www.fool.com/investing/2025/01/03/why-tesla-stock-is-surging-today/?source=eptyholnk0000202&utm_source=yahoo-host-full&utm_medium=feed&utm_campaign=article&referring_guid=29eef9eb-e8b6-4f64-acd1-ca0f85fe531c&.tsrc=rss
"Fri, 03 Jan 2025 19:13:42 +0000","Magnificent Seven Stocks: Nvidia Surges Above Key Level; Tesla Rebounds, Apple Extends Sell-Off","Nvidia extended its rebound Friday, while Apple continued to fall. Tesla bounced back from Thursday's plunge.",https://finance.yahoo.com/m/4205eaa9-f620-3a0b-a81a-0e82c7c9fd0b/magnificent-seven-stocks%3A.html?.tsrc=rss
"Fri, 03 Jan 2025 18:41:44 +0000","Consumer Discretionary, Technology Push US Equity Indexes Higher",US equity indexes rose midday Friday as consumer discretionary and technology topped sector charts w,https://finance.yahoo.com/news/consumer-discretionary-technology-push-us-184144549.html?.tsrc=rss
"Fri, 03 Jan 2025 18:38:00 +0000","Tesla trades more on 'tectonic' narratives, headlines: RBC analyst","Rivian (RIVN) shares surged by over 13% Friday morning — at the time of this video's posting in the afternoon, shares are currently up by over 22% — after beating fourth quarter EV delivery estimates: posting nearly 14,200 EVs during the fourth quarter and delivering nearly 51,580 electric trucks in 2024. On the other hand, Tesla (TSLA) saw a decline in its annual EV sales for the first time in over a decade. RBC Capital Markets Global Autos Analyst Tom Narayan joins the Morning Brief team to weigh in on the two electric automakers' recent performances. ""I think it's both of those may be overanalyzed a little too much,"" Narayan tells Brad Smith and Madison Mills. ""For the Rivian one, we knew the company told us that Q4 was going to be stronger than Q3, they had a supply issue in Q3. The Q4 delivery number was actually consistent with their guidance."" Narayan explains that while Tesla came out below consensus estimates, its EV delivery results were ""still a solid number,"" noting the company to have gotten a boost this past quarter amid conversations around the future of its full self-driving (FSD) capabilities. To watch more expert insights and analysis on the latest market action, check out more Morning Brief here. This post was written by Josh Lynch",https://finance.yahoo.com/video/tesla-trades-more-tectonic-narratives-183800219.html?.tsrc=rss
"Fri, 03 Jan 2025 17:39:04 +0000",Rivian stock surges to start the year on better-than-expected EV deliveries,Rivian stock soared Friday after the electric truck maker reported better than expected vehicle sales for its quarter ending Dec. 31.,https://finance.yahoo.com/news/rivian-stock-surges-to-start-the-year-on-better-than-expected-ev-deliveries-173904321.html?.tsrc=rss
